标题,时间,内容
开展主题教育，为奋进新征程凝心聚力,2023年04月06日13:27,“以县处级以上领导干部为重点在全党深入开展学习贯彻新时代中国特色社会主义思想主题教育，是贯彻落实党的二十大精神的重大举措，对于统一全党思想、解决党内存在的突出问题、始终保持党同人民群众血肉联系、推动党和国家事业发展，具有重要意义。”在学习贯彻习近平新时代中国特色社会主义思想主题教育工作会议上，习近平总书记从新时代新征程党和国家事业发展全局的战略高度，深刻阐述开展主题教育的重大意义和目标要求，对主题教育各项工作作出全面部署，为全党开展主题教育提供了根本遵循。坚持用马克思主义中国化时代化最新成果武装全党、指导实践、推动工作，是我们党创造历史、成就辉煌的一条重要经验。党的十八大以来，以习近平同志为主要代表的中国共产党人，坚持把马克思主义基本原理同中国具体实际相结合、同中华优秀传统文化相结合，创立了习近平新时代中国特色社会主义思想，实现了马克思主义中国化时代化新的飞跃。新时代十年来，我们如期打赢脱贫攻坚战，完成全面建成小康社会的历史任务，实现第一个百年奋斗目标，党和国家事业取得历史性成就、发生历史性变革，最根本的原因在于有习近平总书记作为党中央的核心、全党的核心掌舵领航，在于有习近平新时代中国特色社会主义思想科学指引。党的理论创新每前进一步，理论武装就要跟进一步。在全面贯彻落实党的二十大精神开局之年，在全面建设社会主义现代化国家新征程起步之际，开展学习贯彻习近平新时代中国特色社会主义思想主题教育，正当其时、意义重大。一方面，这是党中央为全面贯彻党的二十大精神、动员全党同志为完成党的中心任务而团结奋斗所作的重大部署。全面建设社会主义现代化国家、以中国式现代化全面推进中华民族伟大复兴，是一项前无古人的开创性事业。面对错综复杂的国际国内形势、艰巨繁重的改革发展稳定任务、各种不确定难预料的风险挑战，要实现党的二十大确定的战略目标，迫切需要广大党员、干部特别是各级领导干部进一步深入学习贯彻习近平新时代中国特色社会主义思想。只有加强理论武装，坚持不懈用习近平新时代中国特色社会主义思想凝心铸魂，在推动学习贯彻习近平新时代中国特色社会主义思想走深走实上下功夫，把习近平新时代中国特色社会主义思想转化为坚定理想、锤炼党性和指导实践、推动工作的强大力量，才能把党的二十大擘画的宏伟蓝图变为现实。另一方面，这是深入推进新时代党的建设新的伟大工程的重大部署。历史和现实都证明，党的团结统一是党和人民前途和命运所系，是全国各族人民根本利益所在；办好中国的事情，关键在党，关键在党要管党、全面从严治党。“教育引导党员、干部从思想上正本清源、固本培元”“教育引导广大党员、干部学思想、见行动，树立正确的权力观、政绩观、事业观，增强责任感和使命感”“教育引导各级党组织和广大党员、干部突出问题导向，查不足、找差距、明方向，接受政治体检，打扫政治灰尘，纠正行为偏差，解决思想不纯、组织不纯方面存在的突出问题”，通过主题教育，必将把党锻造成一块攻无不克、战无不胜的坚硬钢铁，提振锐意进取、担当有为的精气神，使我们党始终充满蓬勃生机和旺盛活力，始终成为中国特色社会主义事业的坚强领导核心。强国建设、民族复兴的宏伟目标令人鼓舞、催人奋进，我们这一代共产党人使命光荣、责任重大。各级要深刻认识开展主题教育的重大意义，不断提高政治判断力、政治领悟力、政治执行力，把主题教育谋划好、组织好、落实好，为奋进新征程凝心聚力。
擦亮“芯片”，让更多好种子破土而出,2023年04月06日09:24,鲜食玉米、彩虹西瓜、樱桃番茄……近日，2023中国种子大会暨南繁硅谷论坛在海南三亚举行，来自264家单位、近2000个已审定和登记的农作物新优品种，荟萃崖州区国家现代农业产业园。作为推进种业振兴的平台和展示成果的窗口，今年展会和论坛的规模尤其不一般，50多家种业及产业链相关企业集中亮相，超过3000位国内外嘉宾和种业从业者在此汇聚，围绕种业振兴和产业发展重点领域把脉建言。农业现代化，种子是基础。从本届大会参展品种看，不仅涵盖玉米、水稻、杂粮、瓜果、蔬菜等作物类型，而且品质型、口感型品种明显增加，映射出现代种业蓬勃发展的身影。近年来，我国有序推进种业振兴行动，在育种创新攻关、种质资源普查、种业企业扶优等方面取得一系列新进展。目前，主要农作物良种基本实现全覆盖，自主选育品种面积占比达到95%以上，玉米、蔬菜、白羽肉鸡等自主种源比例稳步提升，不断夯实我国粮食及重要农产品生产安全根基。今年是种业振兴“三年打基础”收官的关键一年。中央一号文件提出深入实施种业振兴行动。应当看到，我国种业振兴还处于起步阶段，距离实现种业科技自立自强、种源自主可控目标要求仍存在不小差距。面对复杂的国际形势以及仍将长期处于紧平衡状态的国内粮食供求格局，只有用自己的手攥紧中国种子，才能端稳中国饭碗，才能实现粮食安全。同时，践行大食物观，不断丰富“菜篮子”“果盘子”，同样离不开多元化的品种创新。种业强“芯”，关键要靠产业强“链”。小小一粒种子，涉及研发、选育、加工、推广等多个环节，构建现代种业产业链，需要深度打通研发和市场，推动产学研融合、育繁推一体化发展。目前，我国正加快构建“破难题、补短板、强优势”国家种业企业阵型。针对科研生产“两张皮”现象，除了要在科研上着力破除体制机制障碍，鼓励种业科研工作者以市场为导向，推进种源关键核心技术攻关，还要进一步提升企业创新主体地位，发挥好优势种业企业的主板集成作用，加快推动企业与科研单位、金融机构、种业基地对接合作，促进科技和资本有机联动，形成种业创新集聚效应。种业的生命力在于原始创新。在大会上，像韭菜一样割了又长的再生稻、“双色1号”火龙果等新品种尤为亮眼。鼓励高产、绿色、优质的新品种培育，特别是像高产高油大豆、短生育期油菜、耐盐碱作物等市场亟需的专业品种，离不开从育种端到用种端的一系列资源和制度供给。一方面，作为良种选育的基础，要保护和利用好农业种质资源，通过深入推进资源精准鉴定，高效挖掘更多优异性状，促进资源优势不断向创新优势和产业优势转化。另一方面，要强化种业知识产权保护。今年，我国将在立法、司法、执法、管理和技术支撑等五方面发力，加快推行全链条、全流程监管，这将为品种原始创新提供良好环境。春日里的南繁沃野，洋溢着生机与希望。独特的光热资源，使这里成为孕育万千良种的摇篮。随着相关政策和规划相继落地，南繁硅谷建设如火如荼。在一系列配套组合拳下，我们定将形成深入推进种业振兴的强大合力，见证更多好种子破土而出，将14亿多人的饭碗稳稳端在自己手中。
纾难解困，保障中小企业行稳致远,2023年04月06日09:11,中小企业是我国经济的源头活水。近日，工信部印发通知，组织开展2023年“一起益企”中小企业服务行动。此次服务行动以中小企业实际需求为导向，聚焦中小企业疫后恢复急难愁盼问题和制约中小企业创业创新发展的痛点难点问题，旨在发挥中小企业服务体系作用，帮助中小企业提振发展信心、恢复发展活力、增强内生动力。今年以来，我国出台了一系列政策，从加大专精特新中小企业培育力度，到促进科技成果转化和中小企业数字化转型，再到促进大中小企业融通创新，一手抓帮扶、一手抓发展，助力中小企业爬坡过坎，成长壮大。数据显示，今年2月，中小企业发展指数为89.6，在1月大幅回升的基础上，进一步回升0.7个点，连续两个月上升。上扬的数据背后，是中小企业总体形势向好，生产恢复加快，发展信心逐步增强。加快中小企业复苏，让中小企业切实享受到政策红利，相关部门要畅通政策落地“最后一公里”，让政策入企服务入门。比如，通过“政策大讲堂”“政企面对面”等活动，多渠道、多形式宣传解读促进中小企业发展的法律和助企惠企政策。又如，通过政策服务互联网平台和APP，汇集各类法律政策信息，加强智能匹配与精准推送，帮助企业应知尽知、用好用足政策。在此过程中，各部门要主动靠前服务，积极送政策、送管理、送技术，和中小企业一起想办法，解决实际问题，为其可持续发展切实提供支撑和保障，助力中小企业提振信心，加快复苏。加快中小企业复苏，要释放创新活力，加大专精特新企业培育力度。推动创新创业创造发展，离不开良好的社会氛围。从举办“创客中国”中小企业创新创业大赛，开展交流展示、项目孵化、产融对接服务，到大力培育创新型中小企业，再到面向创业者和初创小微企业，提供商业策划、登记注册、商务代理、宣传推广等服务，提高创业便利性和成功率，一系列举措必将进一步点燃中小企业创新创业的激情。实践充分证明，创新是中小企业的灵魂，是其发展和进步的需要。中小企业成为创新主体，中国就能迸发出强大的创新力量。加快中小企业复苏，要强化人才保障，为中小企业注入新鲜血液。创新要依靠人才。一直以来，中小企业面临着吸引人才不易、高端人才招引难等问题。一方面要持续开展企业经营管理人才素质提升工程，深化中小企业经营管理领军人才培训。另一方面，实施专业技术人员知识更新工程、职业技能提升行动，拓展“企业微课”线上课程，加强中小企业多层次人才培训……各地各部门要加大对人才的支持力度，让人进来、留下来，只有解决创新能力不足这一关键问题，中小企业才能破茧成蝶、赢得未来。好政策重在落实。各地需结合本地实际制定实施方案，在帮助中小企业时要有明确的问题导向和目标导向，助力中小企业的发展过程中不能顾此失彼。此次服务行动提出重点开展政策入企服务、创业培育服务、技术创新服务、数字化绿色化转型服务、育才引才服务、管理提升服务、投融资服务、市场开拓服务、权益保护服务等9项服务内容，是促进中小企业高质量发展的题中应有之义。惟有不断提升中小企业获得感和满意度，进一步激发其更大的创新活力，才能为中国经济的高质量发展注入源源不断的动力。
“五个一百”，铸就团结奋进的时代华章,2023年04月05日10:13,“团结奋斗是中国共产党和中国人民最显著的精神标识。”以“团结奋进新征程同心奋斗创伟业”为主题的中国正能量“五个一百”网络精品征集评选活动正在如火如荼开展，透过正能量文字、图片、音视频等五大类网络优秀作品，生动展现在中国共产党的领导下，中国人民万众一心、团结奋进、共创辉煌的时代画卷。团结才能胜利，奋斗才会成功。北京冬奥会、冬残奥会成功举办；中国空间站全面建成、载人航天筑梦星辰大海；疫情防控守望相助、取得决定性胜利；消防官兵与广大群众勠力同心、成功降伏重庆山林“火魔”……一桩桩足以载入历史的大事件、一个个感人至深的鲜活故事，无不折射出齐心协力、众志成城、攻坚克难、奋勇拼搏。“五个一百”活动倾情倾力展示一批大事记以及鲜活的人物图景，不仅是向“点点星火汇聚成炬”致以崇高礼赞，更将进一步凝聚团结奋斗的磅礴正能量，激励更多人握指成拳、撸起袖子加油干。历史还告诉我们，党和人民取得的一切成就都是团结奋斗的结果。焦裕禄、孔繁森、杨善洲、黄文秀……一批又一批优秀共产党人从群众中来、到群众中去，与广大群众并肩奋斗，以自身实际行动深刻诠释了党和人民群众的血肉联系。“五个一百”活动还将展现更多党员干部的使命担当、冲锋在前。始终坚持一切为了人民、一切依靠人民、与人民同甘共苦、与人民团结奋斗的中国共产党，必将带领中国人民不断从胜利走向新的胜利。新征程呼唤接续团结奋斗，伟大时代当共同奋楫扬帆。党的二十大擘画了全面建设社会主义现代化国家的宏伟蓝图。要将蓝图变为现实，必须调动一切可以调动的积极因素，团结一切可以团结的力量，充分发挥亿万人民的创造伟力。只要14亿多中国人在党的旗帜下团结成“一块坚硬的钢铁”，心往一处想、劲往一处使，我们一定能够战胜前进道路上的一切困难挑战，抵达中华民族伟大复兴的光明彼岸。团结就是力量，奋斗开创未来。“五个一百”活动的巨大影响力必将深刻投射到现实生活中，激发同心共圆中国梦的强大合力，引领广大人民群众共创新的更大奇迹。
思念跨山河，致敬英烈再奋发,2023年04月05日09:10,北京的李大钊烈士陵园，河北的狼牙山五勇士纪念塔，山西的太行太岳烈士陵园，辽宁的抗美援朝烈士陵园……目前，六批国家级烈士纪念设施名单公布，共计277处。这些纪念设施，对于人们缅怀忠烈、追思英雄，具有重要的教育纪念意义。一年一清明，一岁一哀思。2023年清明时节，来到烈士纪念地，肃立默哀，鞠躬致敬，敬献花束，是不少人的郑重选择。铭记历史、汲取精神，我们在抚今追昔中更加坚定了奋斗意志。历史的天空中，英烈的名字最闪亮，英雄的事迹最光辉。沿着时间轴走来，有革命战争年代的吕梁儿女，有长征路上的红军战士，有抗日战争中的杨靖宇、左权等一批英烈，有新中国甘做隐姓埋名人的“两弹一星”功勋科学家们……一个个名字书写在了历史的书页上，印刻在了中华儿女的内心深处。硝烟已逝，功勋永存。今天，我们祭奠先人、缅怀英烈，就是为了那份“永不忘却的纪念”。一个有希望的民族不能没有英雄，一个有前途的国家不能没有先锋。我们常说，崇尚英雄才会产生英雄，争做英雄才能英雄辈出。缅怀英烈，是学习传承他们身上热爱祖国、忠于人民、无私奉献、敢于牺牲的精神的过程；缅怀英烈，也是从精神的高度出发，洗礼我们的精神世界，重整行装再出发的过程。精神的伟力，总是催人奋进，让无数人有动力、有激情争做英雄群体中的一员。惟其如此，我们的民族精神才能生生不息，我们的信仰光芒才能光辉闪耀。越是和平时期，越要珍视英烈们留存下来的精神遗产，越要崇尚那些英雄忠魂。他们之中，有守护万家灯火的人民警察，有火情灾情前线的救援者，有疫情袭来时逆战而行的白衣天使，有守护国门、寸土不让的官兵，有冒着生死危险在海外撤侨的外交人员……一个个逆行的背影，一句句庄重的誓言，一次次不屈的前行，组成了一幅可爱可敬、可歌可泣的英雄图谱。忠魂不泯，浩气长存。当前，我们不仅要用实际行动，做到铭记英雄、崇尚英雄、捍卫英雄、学习英雄、关爱英雄；更要真实地、真挚地讲好英雄故事，让英雄事迹点燃人们心中的精神火炬。这是我们现在缅怀英烈应有的意义，也是我们继承英雄意志应有的真诚。一切伟大成就都是接续奋斗的结果，一切伟大事业都需要在继往开来中推进。强国建设、民族复兴的宏伟目标令人鼓舞、催人奋进，我们每个人都使命光荣、责任重大。新的征程上，对英烈最好的纪念，就是把他们开创的事业不断推向前进；对历史最好的致敬，就是不断创造新的历史伟业。前进道路上，我们还会面临不少挑战和风险，需要跨过一个个坎、越过一道道沟。我们也要像英烈们一样去奋斗、像英雄们一样去搏击，为属于我们的事业不断拓宽那条人间正道。无限的敬意，无尽的追思，无穷的力量。“思念跨山河，山河皆不忘”“今天的中国，如你们所愿”“先烈们守护过的山河，万里锦绣”“英烈不求回报，我们却未曾忘怀”……这几天，网友们纷纷给英烈们写下缅怀话语，读来让人泪目感怀。青山脚下埋忠骨，英烈精神代代传。让我们秉承英烈遗志、赓续英雄精神、担当历史使命，向着新目标奋楫再出发！
清明绿色祭扫共创文明新风尚,2023年04月03日10:42,清明将至，各地逐渐迎来祭扫高峰。在人们寄托哀思、慎终追远的同时，许多地方发出文明祭扫倡议，殡仪机构还提供免费鲜花、环保追思等服务，方便群众绿色扫墓。清明时节，华夏儿女礼敬先祖、缅怀英烈，体现着敦亲睦族、赓续血脉的深厚人文精神。而祭奠与踏青相融合，也蕴含周而复始、人与自然和谐共生的智慧之道。春天，万物更新，吐故纳新。于我们而言，既要从传统文化中汲取优秀因子，也当积极移风易俗、摒弃陈规陋习。比如，大量焚烧冥钱、香烛乃至“纸豪宅”，不仅使本应清朗肃穆的祭奠变得乌烟瘴气、污染生态，熊熊火焰更有严重火灾隐患。看似排场热闹的陈旧祭扫方式，其实与现代文明风尚格格不入，糟粕陋习理当摒弃。逝者已矣，生者如斯。缅怀祭奠重在于“心”，寄托哀思、继承遗志、表达情愫的方式应与现代精神文明的要求契合，祭扫的形式当与时俱进。比如，为逝者献上一束鲜花表达思念之情、种植一棵绿树寓意新生，都是很好的形式。殡仪机构也在积极提供绿色祭奠服务。比如，北京市八宝山殡仪馆推出“亲情祭祀水溶祭情”追思活动，伴着悠扬的古琴声，工作人员为逝者敬献花篮、代诵祭文后，将写有祝福语的千纸鹤、纸船缓缓放进小水潭中，用水溶纸折成的纸鹤、纸船遇水慢慢溶解。这样的祭奠不仅具有深厚表意，而且蕴含现代写意，令人回味动容。再加上近年兴起的网络祭扫、时空信箱等等，人们缅怀先人的载体更加丰富，在感谢岁月、珍惜生命、释放情愫中，人们也将获得更强的前行动能。值得一提的是，我们让文明理念深入人心并转化为行动，还要进一步加强宣传和引导。各地有关部门应将清明祭扫与弘扬孝老爱亲、传承良好家风结合起来，在注重移风易俗的同时，树立“行孝要尽早”理念。大力推进移风易俗是提升公众文明素养和社会文明程度的重要环节。文明祭奠，绿色扫墓，让清明“清洁明净”，共创安全、简约低碳的祭祀新风尚，必将使社会文明更进一步。
锚定目标，推动东北地区旅游业高质量发展,2023年04月03日09:45,到2025年，跨区域旅游一体化发展格局基本形成，旅游产品供给、服务质量、治理能力显著提升；到2030年，基本建成世界级冰雪旅游度假地、全国绿色旅游发展引领地和边境旅游改革创新样板地，跨区域旅游一体化发展格局进一步夯实……近日，文化和旅游部、国家发展改革委联合印发《东北地区旅游业发展规划》（以下简称《规划》），描绘出东北地区旅游业转型升级和高质量发展的未来图景。东北地区历史文化悠久、民族风情浓郁、生态类型多样、自然景观独特，各类旅游资源禀赋高、数量多、类型全，发展旅游业具有众多优势。近年来，东北地区旅游业快速发展，成为我国重要的特色旅游目的地，冰雪旅游、避暑旅游、自驾旅游、边境旅游等具有东北特色的旅游品牌深入人心。还要看到，当前东北地区旅游业发展不平衡不充分问题仍然突出，存在跨区域共建共享机制尚不健全、旅游基础设施及配套建设尚不完善、优质旅游产品供给不足、产业综合带动作用发挥不充分等短板弱项。补足短板、发挥优势，为东北地区旅游业高质量发展夯基垒台，尤须将《规划》确定的各项要求落到实处。发展旅游业必须因地制宜、找准定位、突出特色。立足得天独厚的冰雪资源，东北多地推进寒地冰雪经济加快发展，将“冰雪天地”变成“金山银山”。数据显示，2022年、2023年雪季，吉林省仅春节假期便实现国内游客和旅游收入分别同比增长23.61%和33.31%，黑龙江省群众冰雪运动参与率升至57.8%，辽宁省春节假期滑雪场营业收入整体效益达去年同期2.5倍。实践证明，只有结合各地的历史、地理、人文、风俗，努力培育具有地域特色的旅游品牌，才能吸引游客、留住游客。锚定《规划》明确的世界级冰雪旅游度假地、全国绿色旅游发展引领地、边境旅游改革创新样板地、跨区域旅游一体化发展实践地四个最新定位，擦亮寒地冰雪、生态林海、边境风光、北国海滨、草原天路、黑土民俗等精品旅游线路品牌，有助于推动东北地区旅游业整体实力和竞争力提升。攥指成拳，方能凝聚合力。从以现有旅游交通为骨架构建“三纵三横”旅游“大通道”，到以东北地区核心旅游资源为主题打造“三圈两带”旅游“大板块”，再到培育冰雪产业、森林旅游产业、滨海旅游产业“大集群”，《规划》把东北地区作为一个整体，深化区域旅游协同发展，推动由“单打独斗、相互竞争”转向“协同作战、合作共赢”。东北地区地域相近、人缘相亲、经济相融、文化相通，推进旅游交通一体化、营销推广一体化、市场监管一体化、服务标准一体化具有良好基础。坚持一盘棋思维，优化整合区域资源，做到统一谋划、一体部署、协同实施，实现区域内产品共建、资源共享、客源互送，能够显著增强东北旅游在国内国际的影响力和吸引力。还应看到，高质量发展要靠创新。实施创新驱动发展战略为旅游业赋予新动能，也对旅游业提出了创新发展的新要求。推动东北地区旅游业高质量发展，要把“改革开放，创新驱动”作为基本原则之一，坚持创新是第一动力，加快大数据、云计算、物联网、区块链及5G、北斗系统、虚拟现实、增强现实等新技术在旅游领域的应用普及，以科技创新提升旅游业发展水平。创新为旅游业赋能，不仅体现在科技手段方式上，也体现在体制机制层面。推进智慧旅游发展，推动旅游领域机制创新、模式创新、业态创新，才能在未来激烈的市场竞争中闯出一片天地。一分部署，九分落实。把蓝图变为现实，需要以《规划》实施为契机，细化落地各项工作，推动东北地区旅游业高质量发展取得实绩实效。展望2035年，一个世界级冰雪旅游度假地、全国绿色旅游发展引领地和边境旅游改革创新样板地，将为东北地区基本实现社会主义现代化作出积极贡献。
