标题,时间,内容
织牢文物安全防护网，为中华文明传承护航,2023年03月02日08:14,破获江苏常州“5.29”系列盗掘工地古墓葬案，追缴3.7万件涉案文物，累计侦破各类文物犯罪案件1700余起，打掉犯罪团伙310余个……2022年，公安机关会同国家文物局推动全国打击防范文物犯罪专项行动向纵深开展，一件件重大文物案件成功侦破，沉重打击了犯罪分子的嚣张气焰，取得了显著成效，令人拍手称快。文物是重要的文化遗产，承载着中华民族的灿烂文明，传承着五千多年的历史文化，做好文物保护工作意义重大。党的十八大以来，党中央对提升文物保护水平提出更高要求。从《关于办理妨害文物管理等刑事案件适用法律若干问题的解释》发布，到《涉案文物鉴定评估管理办法》出台，从《国务院办公厅关于进一步加强文物安全工作的实施意见》公布，到公安部会同国家文物局连续6年部署开展全国打击防范文物犯罪专项行动，推动文物安全状况不断好转，充分彰显了各部门向文物犯罪雷霆亮剑、为中华文明传承护航的决心，切实织密织牢了文物安全防护网，筑起了一道道保护文物安全的坚固防线。文物是一个国家的历史见证，承载着一个民族的基因。做好文物保护工作，不仅是对文明和历史文化的传承，又能积极促进文化产业和旅游业的发展，更能展现独特的人文景观。但也要清醒看到，保护文物安全是一项长期而又艰巨的工作，当前盗掘、盗窃等上游犯罪屡打不绝，倒卖文物犯罪呈现多发势头，犯罪职业化、智能化日趋明显，加速向网上蔓延，文物安全属地管理主体责任履行不到位、监管缺失，执法机构队伍薄弱、管理不到位等，都给打击防范工作带来新的挑战，文物保护工作依然任重道远。这需要各部门进一步通力协作，利用新技术、新手段、新装备，大力加强文物保护科技创新，加强专业文物督察、文物执法力量建设，实现文物安全保护与现代化科技融合创新，持续提升文物保护智慧水平，确保文物安全。保护文物就是保护国家与民族的历史，守护中华民族的根与魂。保护好、利用好文物资源是全社会共同的责任。有关部门要加强顶层设计和统筹部署，持续部署联合开展专项行动、联合开展专题活动，让文物安全严防严打严管严治机制日趋完善。各部门要守土尽责，提高素质能力和依法管理水平，保持决心不变、力度不减、干劲不松，才能取得更大成效。同时，要广泛动员社会力量参与，依靠广大人民群众保护文物，鼓励群众在发现、举报和制止盗卖文物犯罪、提供破案线索等方面发挥作用，努力形成人人有责、各尽其责，全社会共同参与文物保护的新格局，守护好老祖宗留下的宝贵遗产。与此同时，在保护好文物的前提下，要加强对文物的研究和利用，让历史说话，让文物活起来。推动中华文明创造性转化和创新性发展，需要让收藏在深宫里的文物、陈列在广阔大地上的遗产、书写在古籍里的文字都活起来。激活其生命力，释放文物承载的文化力量、文化精神，让人民群众看得懂、喜欢看，更好地触摸过往、感知历史，使文物保护成果更多惠及群众，才能让文物的光芒穿越历史、照进现实、点亮未来。
靠实干开创更加美好的未来,2023年03月02日07:53,2023年全国两会来了。这是汇集众智、凝聚共识的关键时刻，也是为改革计、为发展谋的重要场合。万众瞩目中，代表委员履职尽责，亿万人民携手共进，一起书写“团结才能胜利，奋斗才会成功”的崭新篇章。回望过去一年，既有困难和挑战，也有豪情万丈的砥砺前行。党的二十大胜利召开，经济保持增长，粮食喜获丰收，就业物价基本稳定，民生保障扎实，脱贫攻坚成果不断巩固，科技成果捷报频传，生态环境持续改善，全面从严治党深入推进，大国外交成绩显著……这些来之不易的成就，是党和人民一道拼出来、干出来、奋斗出来的，每个人都是壮阔征程的见证者、参与者、书写者。用汗水浇灌收获，以实干笃定前行。乡村振兴、社会治理、科技创新、教育改革、民生保障、生态环保……前进道路上，任何一项事业都不是喊出来的，而是实实在在干出来的。面对错综复杂的国际国内形势和攻坚克难的艰巨任务，一切难题只有在实干中才能破解，一切举措只有在实干中才能见效，一切机遇只有在实干中才能把握。从一份份扎实的提案议案，到一张张缜密的发展答卷，全国两会必将汇聚社情民意、凝聚奋进伟力，激扬顽强拼搏、奋勇搏击的时代主旋律。党的二十大制定了当前和今后一个时期党和国家的大政方针，描绘了以中国式现代化全面推进中华民族伟大复兴的宏伟蓝图。大道至简，实干为要。新征程是充满光荣和梦想的远征，没有捷径，唯有实干。展望未来，基本实现现代化要靠实干，全面建成社会主义现代化强国要靠实干，实现中华民族伟大复兴要靠实干。知行合一、笃行不怠，才能实现新征程的良好开局；真抓实干、埋头苦干，才能把宏伟目标变为美好现实。今年是全面贯彻党的二十大精神的开局之年。梦想越伟大，越要一步一个脚印去实现；目标越宏远，越要一步一个台阶去抵达。在宏伟蓝图面前，要脚踏实地，埋头苦干，不驰于空想，不骛于虚声；在繁重任务面前，要笃实好学，尊重实际，不违背规律，不盲目蛮干；在困难挑战面前，要求真务实，注重实效，不做表面文章，不耍花拳绣腿。众志成城同心干，撸起袖子加油干，久久为功扎实干，更大的奇迹等待我们去实现，更美好的明天等着我们去开启。“追风赶月莫停留，平芜尽处是春山。”实干方能兴邦、实干方能强国、实干方能富民。把思想和行动统一到党的二十大精神和党中央的决策部署上来，以奋发有为的精神状态、真抓实干的过硬作风，“实”字当头，“干”字为先，我们就一定能在这个春天凝聚新的奋进力量、创造新的历史伟业。我们靠实干创造了辉煌的过去，也必将靠实干开创更加美好的未来。
“五个一百”，触摸时代才能引领未来,2023年02月28日10:02,盼望着、期待着，春天来了。一幅生机活力的画卷，正在徐徐铺展。我们，都是画卷的创作人，也是画卷的赏析者，犹如为时代画像、为时代立传，凝结着时代奔流的精神气韵。一个时代，恰恰有一种魅力，让最美的人脱颖而出，为最好的事倾情书写。这些生动的时代注脚，投射在互联网空间，激荡着满满的“正能量”。它们具体化为一行行文字、一张张图片、一段段音视频、一个个专题专栏和主题活动，又汇聚成一个响亮的品牌——中国正能量“五个一百”网络精品。前不久，2022中国正能量“五个一百”网络精品征集评选展播活动正式启动，以正能量引领亿万流量，用主旋律奏响奋进乐章。以作品的维度看，“五个一百”呼唤精品力作。这次活动以“团结奋进新征程同心奋斗创伟业”为主题，立足新时代新征程新伟业，突出主题引领、全媒体系、全民参与。迎接宣传贯彻党的二十大、北京冬奥会、北京冬残奥会、疫情防控……这些重大主题，不仅是涵养精品力作的沃土，更是用一个个精品内容书写了各自的庄重、精彩与震撼。从这个意义上说，透过精品，我们看到的是标注时代发展的大主题、大逻辑，体悟到的是重大主题背后的精神力量。由此，互联网空间里的时代与中国，更加洋溢着春意与生气。以时代的维度看，“五个一百”触摸强劲脉动。时代的年轮，圈圈相绕，以一年计，足以照见不凡。看过去的一年，国内生产总值超过120万亿元，粮食生产实现“十九连丰”，因时因势优化调整防控措施，成功举办北京冬奥会、冬残奥会，中国空间站全面建成，第三艘航母“福建号”下水……这一切，凝结着无数人的辛勤付出，映照着新时代的点点星火。从中，“五个一百”精选而来的好内容、好作品，成为伟大时代的生动写照。由此，时代坐标里的中国力量再次被汇聚，感染着人、鼓舞着人、引领着人。以未来的维度看，“五个一百”点燃前行信心。记录时代，是为了记住时代；触摸时代，是为了引领未来。从明天看今天，我们心怀梦想、充满活力、抖擞精神，倍增前行信心。从今天看明天，我们要以团结凝聚力量、以奋斗创造奇迹、以实干赢得未来，一往无前、顽强拼搏，让明天的中国更美好。今天的“五个一百”，汇聚的正是百分之百的澎湃势能，释放的也是百分之百的澎湃动能。在这个充满挑战又充满希望的时代，我们始终高扬正能量的风帆，发光发热、踔厉奋发，坚定信心、起而行之，拧成一股绳，铆足一股劲，才能携手共进抵达更美好的未来。新时代大有可为，正能量无处不在。在全党全国上下深入学习宣传贯彻党的二十大精神之际，以中国正能量“五个一百”网络精品征集评选展播活动为重要契机，开展线上线下联动的立体展播，不断丰富网络正能量内容供给，让网络里的中国尽显发展活力，让时代里的中国奏响奋进凯歌，我们必定能在绘写壮丽时代、激昂拼搏精神中翻开新的篇章、创造新的奇迹。
推进中国式现代化必须抓好开局之年工作,2023年02月26日10:29,开年就开跑，起步即冲刺。1月，我国实际使用外资金额1276.9亿元，同比增长14.5%，规模稳步上升，结构持续优化，彰显中国依然是外商投资兴业的热土，与在华外资企业共享中国构建新发展格局新机遇；制造业采购经理指数（PMI）为50.1%，比上月上升3.1个百分点，升至临界点以上，制造业景气水平明显回升；对实体经济发放的人民币贷款增加4.93万亿元，同比多增7308亿元，金融活水进一步流向企业，企业发展信心明显增长；快递业日均件量快速恢复至3亿件以上，折射出我国消费市场需求加快释放、经济发展充满活力的态势……一系列振奋人心的数据，折射开年以来中国经济昂扬奋进的良好势头，见证全国上下扎实推进中国式现代化的坚强决心。今年是全面贯彻落实党的二十大精神的开局之年。概括提出并深入阐述中国式现代化理论，是党的二十大的一个重大理论创新。“推进中国式现代化必须抓好开局之年的工作。”开局关乎全局，起步决定后程，远征始于脚下。我们要以斗争精神迎接挑战，以奋进拼搏开辟未来，以狠抓落实夯基筑台，以改革创新开拓新局，为全面建设社会主义现代化国家开好局起好步，为谱写中国式现代化新篇章发好力、尽好责。前无古人的伟大事业，波澜壮阔的宏伟梦想，从来都是以战略擘画为开端、以狠抓落实为保障。党的二十大报告深刻阐述了中国式现代化的中国特色、本质要求和重大原则，对经济、政治、文化、社会、生态文明等重要领域作出新的部署，就科教兴国战略、人才强国战略、创新驱动发展战略等重大战略提出新的要求。这些重要部署是中国式现代化宏图伟业的具体承载，也是全面建设社会主义现代化国家战略布局的任务分解。抓好开局之年工作，必须着眼战略全局、胸怀“国之大者”，结合具体实际，找准发力方向，增强贯彻落实各项部署的自觉性和坚定性，一步一个脚印把党的二十大作出的重大决策部署付诸行动、见之于成效。推进中国式现代化，是一项前无古人的开创性事业，必然会遇到各种可以预料和难以预料的风险挑战、艰难险阻甚至惊涛骇浪。新的一年，新的征途，中国改革发展需要攻坚的问题难关、需要克服的风险挑战，只会比以往多，不会比以往少。要增强忧患意识，坚持底线思维，敢于斗争、善于斗争，通过顽强斗争打开事业发展新天地。要把握“稳与进”的辩证，坚持稳字当头、稳中求进，更好统筹国内国际两个大局，更好统筹疫情防控和经济社会发展，更好统筹发展和安全。推进中国式现代化是一个探索性事业，还有许多未知领域，需要我们在实践中去大胆探索，通过改革创新来推动事业发展。既做好当前工作，又为今后夯实基础、做好衔接，改革是一个重要法宝。中央经济工作会议明确，“谋划新一轮全面深化改革”。抓好开局之年工作，必须正确处理好顶层设计与实践探索等一系列重大关系，通过改革创新着力破解深层次体制机制障碍，更好统筹当前和长远，努力把制度优势更好转化为治理效能。在2023年新年贺词中，习近平总书记引用了苏轼的一句话：“犯其至难而图其至远”，意思是说“向最难之处攻坚，追求最远大的目标”。沿着中国式现代化这条“强国建设、民族复兴的唯一正确道路”坚定向前，我们意气风发，我们信心满怀。拿出“拼”的精神、“闯”的劲头、“实”的作风，众志成城同心干，我们必能为全面建设社会主义现代化国家开好局起好步。
用党的二十大精神统一思想和行动,2023年02月25日08:02,扬帆开新局，奋楫再出发。在全党全国各族人民深入学习贯彻党的二十大精神、意气风发踏上全面建设社会主义现代化国家新征程之际，即将召开的全国两会吸引世界关注、备受各界期待。正所谓一年之计在于春。我们期待新一届代表委员们，为贯彻落实党的二十大决策部署聚众智、建诤言、献良策，为实现新时代新征程的目标任务汇聚广泛的智慧和力量。党的二十大擘画了全面建设社会主义现代化国家、以中国式现代化全面推进中华民族伟大复兴的宏伟蓝图，科学谋划了未来一个时期党和国家事业发展的目标任务和大政方针，吹响了奋进新征程的时代号角。学习宣传贯彻党的二十大精神是当前和今后一个时期全党全国的首要政治任务。只有全面、系统、深入学习，才能完整、准确、全面领会党的二十大精神，对是什么、干什么、怎么干了然于胸，为贯彻落实打下坚实基础。全国两会作为齐众心、汇众力、聚众智的重要平台，作为共商国是、民主决策的重要渠道，只有全面贯彻落实党的二十大精神，自觉用党的二十大精神统一思想和行动，才能进一步动员全党全国各族人民更加紧密地团结起来，朝着新的奋斗目标奋勇前进。加快构建新发展格局，着力推动高质量发展；实施科教兴国战略，强化现代化建设人才支撑；发展全过程人民民主，保障人民当家作主……党的二十大报告从12个方面对各领域各方面工作作出部署，这是根据“五位一体”总体布局、“四个全面”战略布局确定的。把这些重大决策部署落实到实处，一方面要加强顶层设计、科学谋划“时间表”“施工图”；另一方面要把顶层设计和实践探索结合起来，汇聚更多来自基层一线的智慧和力量，努力创造可复制、可推广的新鲜经验。代表委员们身处改革发展的最前线、置身创新突破的最前沿，紧紧围绕党的二十大作出的各项战略部署凝心聚力、建言献策，提供更多促改革、抓落实、解难题的思路和方法，必能使制定的规划和政策体系体现时代性、把握规律性、富于创造性，推动各项决策部署落地生根、见之于成效。越是形势复杂，越是任务艰巨，越要坚定信心、迎难而上。当前，世界之变、时代之变、历史之变正以前所未有的方式展开，我国发展进入战略机遇和风险挑战并存、不确定难预料因素增多的时期，必须准备经受风高浪急甚至惊涛骇浪的重大考验。学习党的二十大精神，必须紧密联系我国发展面临的新的战略机遇、新的战略任务、新的战略阶段、新的战略要求、新的战略环境，深刻认识实现全面建设社会主义现代化国家各项目标任务的艰巨性和复杂性，增强贯彻落实的自觉性和坚定性。唯有保持“咬定青山不放松”的执着、激发“越是艰险越向前”的干劲，依靠顽强斗争打开事业发展新天地，才能把我国发展进步的命运牢牢掌握在自己手中。代表委员们肩负人民重托、承载殷切期待，更要心怀国之大者，在敢于斗争、善于斗争上当先锋，在真抓实干、狠抓落实上作表率。踏上充满光荣和梦想的远征，更宏伟的目标等待我们去实现、更艰巨繁重的考卷等待我们去回答。如何把党的二十大擘画的宏伟蓝图变为现实？如何不断实现人民对美好生活的向往？如何一步一个脚印推进中国式现代化建设？两会会场上的“好声音”，值得期待。
协同构建中国特色国家实验室体系,2023年02月24日18:15,加强基础研究，是实现高水平科技自立自强的迫切要求，是建设世界科技强国的必由之路。日前，在中共中央政治局第三次集体学习时，习近平总书记指出：“基础研究处于从研究到应用、再到生产的科研链条起始端，地基打得牢，科技事业大厦才能建得高。”这为新时代新征程加强基础研究、夯实科研基地指明了方向、提供了遵循。强化基础研究前瞻性、战略性、系统性布局，关键要强化国家战略科技力量，注重发挥国家实验室引领作用、国家科研机构建制化组织作用、高水平研究型大学主力军作用和科技领军企业“出题人”、“答题人”、“阅卷人”作用。如今，世界已经进入大科学时代，基础研究组织化程度越来越高，制度保障和政策引导对基础研究产出的影响越来越大。从这个意义上说，协同构建中国特色国家实验室体系，不仅正当其时、十分必要，而且要科学规划、高效建设。当前，中国特色的国家实验室体系正在加快构建。2021年编制完成了重组国家重点实验室体系方案；“十四五”规划和2035年远景目标纲要部署“加快构建以国家实验室为引领的战略科技力量”；“建立健全以国家实验室为引领、全国重点实验室为支撑的实验室体系”写入科学技术进步法；党的二十大报告明确，“形成国家实验室体系”……一系列部署、任务和要求，为构建中国特色国家实验室体系明确了重点、提供了支撑。这也意味着，一支成体系、担使命的战略科技力量正在孕育，国家创新体系更加高效顺畅，科技潜力加速释放，未来可期。协同构建中国特色国家实验室体系，重点是“体系”。这不是某个单一领域内的实验室建设，也不是某个单一学科内的任务，需要按照“四个面向”的要求，紧跟世界科技发展大势，适应我国发展对科技发展提出的任务要求，多出战略性、关键性重大科技成果，形成体系化。要聚焦量子信息、光子与微纳电子、网络通信、人工智能、生物医药、现代能源系统等重大创新领域，组建一批国家实验室；要重组国家重点实验室，形成结构合理、运行高效的实验室体系。只有坚持使命驱动、任务导向，国家实验室体系才能发挥党和国家作为重大科技创新领导者、组织者的作用，构建关键核心技术攻关的高效组织体系。协同构建中国特色国家实验室体系，关键是“协同”。体系化建设，需要系统规划、系统作战，需要树立系统思维和协同观念。这就需要完善科技创新体制机制，构建社会主义市场经济条件下关键核心技术攻关的新型举国体制，把集中力量办大事的制度优势、超大规模的市场优势，同发挥市场在资源配置中的决定性作用结合起来，以健全国家实验室体系为抓手，加快建设跨学科、大协作、高强度的协同创新基础平台。同时，要优化国家科研机构、高水平研究型大学、科技领军企业定位和布局，整合优化科技资源配置，以国家战略性需求为导向推进创新体系优化组合。多方协作、凝聚合力，分类分层、重点突出，加强相关工作前瞻性谋划、整体性推进。世界科技强国竞争，比拼的是国家战略科技力量。继续加强科技基础能力建设，在力量构建、资源配置、基础设施、科研平台、创新生态等方面夯实基础，在包括中国特色国家实验室体系等在内的基础研究骨干网络的布局建设上加快推进，必定能让国家战略科技力量更加强大，为建设科技强国注入强劲动能。
要千方百计搜救失联人员,2023年02月24日12:27,2月22日13时许，内蒙古阿拉善盟阿拉善左旗新井煤业有限公司露天煤矿发生大面积坍塌，令人揪心痛心。习近平总书记高度重视并作出重要指示，强调“要千方百计搜救失联人员，全力救治受伤人员，妥善做好安抚善后等工作”，要求“尽快查明事故原因，严肃追究责任，并举一反三，杜绝管理漏洞”。此次事故造成多人失联和人员伤亡，全力搜救被埋人员，全力救治受伤人员，是当务之急。事故发生后，应急管理部等部门派出工作组指导救援工作，国家卫健委安排国家紧急医学救援队专家赶赴当地，内蒙古自治区、阿拉善盟迅速组织力量开展救援。救援工作十万火急，一方面要立足于“快”，尽最大努力、以最快速度救援失联人员，备足人员力量和救援设备，分秒必争；另一方面要着眼于“安全”，科学组织开展施救工作，加强监测预警，防止次生灾害的发生。当前，随着我国复工复产步伐的加快，经济社会发展各项工作稳步推进，呈现出良好势头。但也要看到，经济快速复苏期，往往也是安全生产关键期，特别是矿山、危化、建筑、交通、消防等重点行业领域，一旦风险隐患排查不及时、管理出现漏洞，就容易造成隐患累积、事故多发。一段时间以来发生的安全生产事故一再给我们敲响警钟：安全生产“一失万无”，须臾不可放松。生命重于泰山，责任重于泰山。越是风险隐患叠加，越要保持“时时放心不下”的责任感狠抓工作落实，以时不我待的紧迫感筑牢守好安全生产的堤坝。此前发生一些事故，就暴露出在安全生产领域还存在管理不到位、责任不落实、工作不扎实等共性问题，一些地方重大风险防控存在盲区、风险管控存在严重漏洞、安全监管压力传导不足。各地区各部门要吸取深刻教训，针对安全生产事故主要特点和突出问题，层层压实责任，狠抓整改落实，强化风险防控，从根本上消除事故隐患。要举一反三，全面排查整治各类风险隐患，盯紧看牢高危行业领域重大风险，重大隐患拉出单子、盯住整改，重大危险源落实包保责任，推动安全生产关口前移，坚决防范重特大事故发生，不断提升安全发展水平。内蒙古煤矿坍塌事故救援正在紧张进行。据报道，事故现场在2月22日傍晚6点多发生了二次坍塌，救援难度很大，各方救援力量更应科学施救，尽最大可能、最大限度捍卫生命，减少伤亡。此次事故教训极其深刻，认真吸取教训，把安全生产这根弦绷得紧而又紧，把各项安全责任措施抓得实而又实，才能牢牢守住安全生产底线，切实维护人民群众生命财产安全和社会大局稳定。
